apiVersion,reference,url,contentType,language,databaseLabel,database,summary,weight,content,accessRestriction,children,highlightedFragments,citation,metadata.identifier,metadata.es_ContentType,metadata.es_SortDate,metadata.deadlineDate,metadata.language,metadata.title,metadata.type,metadata.url,metadata.typesOfAction,metadata.esST_URL,metadata.callccm2Id,metadata.DATASOURCE,metadata.REFERENCE,metadata.frameworkProgramme,metadata.startDate,metadata.deadlineModel,metadata.status,metadata.caName,metadata.description,metadata.projectAcronym,fetched_at
2.148.3,14101COMPETITIVE_CALLen,https://ec.europa.eu/info/funding-tenders/opportunities/portal/screen/opportunities/competitive-calls-cs/45653635,text/plain,en,SEDIA,SEDIA,FS4Africa Open Call 2 (OC2) addressed to innovation hubs,0.0,FS4Africa Open Call 2 (OC2) addressed to innovation hubs,False,[],[],EU-Africa Union – food safety. Available at: https://ec.europa.eu/info/funding-tenders/opportunities/portal/screen/opportunities/competitive-calls-cs/45653635,['HORIZON-CL6-2023-FARM2FORK-01-20'],['text/plain'],['2026-05-18T00:00:00.000+0000'],['2026-08-31T17:00:00.000+0000'],['en'],['EU-Africa Union – food safety'],['8'],['https://ec.europa.eu/info/funding-tenders/opportunities/portal/screen/opportunities/competitive-calls-cs/45653635'],,['https://ec.europa.eu/info/funding-tenders/opportunities/portal/screen/opportunities/competitive-calls-cs/45653635'],['14101'],['SEDIA'],['14101COMPETITIVE_CALLen'],['43108390'],['2026-05-18T00:00:00.000+0000'],['single-stage'],['31094502'],['FS4Africa Open Call 2 (OC2) addressed to innovation hubs'],"['<p class=""ql-align-justify"">The implementation of the FS4Africa sub-projects will be divided in 3 phases: Design (M1), Development (M2-M6), and Validation (M7-M8 months). Each of the 3 phases will be completed with submission of a deliverable, which summarises the work done during that phase. The review process will follow each phase of the implementation. Once the deliverable is received, it will be assessed by the FS4Africa Open Call Advisory Board members. A request for the deliverable\'s update may occur with specific requirements for what should be modified. Based on the results of the review and acceptance of respected deliverables, payment will be made towards the subgrantees in the following modalities:</p><ol><li data-list=""ordered"" class=""ql-align-justify""><span class=""ql-ui"" contenteditable=""false""></span>Phase 1 - Design (1 month / February 2027: Payment of 20% of the total grant [Deliverable: Training Activity plan];</li><li data-list=""ordered"" class=""ql-align-justify""><span class=""ql-ui"" contenteditable=""false""></span>Phase 2 - Development (5 months / March 2027 – July 2027): Payment of 50% of the total grant [Deliverable: Training Delivery Report];</li><li data-list=""ordered"" class=""ql-align-justify""><span class=""ql-ui"" contenteditable=""false""></span>Phase 3 - Validation (2 months / August 2027 – September 2027): Payment of the final 30% of the total grant [Deliverable: Final Report of the training activities].</li></ol><p class=""ql-align-justify"">Each Open Call 2 proposal must propose and implement a structured programme consisting of at least six (6) training–mentoring activities during the implementation period.</p><p>The required activities must include:</p><p><strong>A. Support to Open Call 1 (OC1) Beneficiaries </strong></p><p>Applicants must deliver at least two (2) training activities to support at least two (2) distinct Open Call 1 beneficiaries i.e. sub-projects (minimum two trainings in total, joint or dedicated sessions permitted). The two activities must involve at least two different OC1 sub-projects (i.e. not both activities mapped to the same OC1 beneficiary). The content should be tailored to the needs of the supported OC1 sub-projects and aligned with the relevant food safety challenges.</p><p><strong>B. Support to FS4Africa Use Cases</strong></p><p class=""ql-align-justify"">Applicants must deliver at least four (4) training–mentoring activities targeting actors involved in one or more FS4Africa Use Cases in collaboration with other OC2 projects. Following selection, Open Call 2 sub-projects will coordinate among themselves, with support from the FS4Africa Executive Board (WP Leaders) and the Open Call team, through structured information exchange and alignment meetings to ensure balanced thematic coverage across all four FS4Africa Use Cases. Collaboration among OC2 sub-projects implies structured coordination of thematic focus, training design, delivery schedules, or mentoring approaches to ensure complementarity, avoid duplication, and maximise collective coverage of FS4Africa Use Cases.</p><p class=""ql-align-justify"">Training–mentoring activities may take the form of online courses, webinars, interactive workshops, mentoring clinics, or other structured capacity-building formats. Joint or co-organised activities between OC2 sub-projects are optional but encouraged. Where such joint activities are implemented, they may count towards the minimum number (at least four) of required training–mentoring activities for each participating sub-project, provided that each sub-project’s role and contribution are clearly defined.</p>']",['FS4Africa'],2026-07-05 07:28:53.466610+00:00
2.148.3,14143COMPETITIVE_CALLen,https://ec.europa.eu/info/funding-tenders/opportunities/portal/screen/opportunities/competitive-calls-cs/45704318,text/plain,en,SEDIA,SEDIA,AID4SME Open Call 2,0.0,AID4SME Open Call 2,False,[],[],"Industrial leadership in AI, Data and Robotics boosting competitiveness and the green transition (AI Data and Robotics Partnership) (IA)[[https://www.europarl.europa.eu/RegData/etudes/STUD/2021/662906/IPOL_STU(2021)662906_EN.pdf]]. Available at: https://ec.europa.eu/info/funding-tenders/opportunities/portal/screen/opportunities/competitive-calls-cs/45704318",['HORIZON-CL4-2024-DIGITAL-EMERGING-01-04'],['text/plain'],['2026-05-15T00:00:00.000+0000'],['2026-07-15T17:00:00.000+0000'],['en'],"['Industrial leadership in AI, Data and Robotics boosting competitiveness and the green transition (AI Data and Robotics Partnership) (IA)[[https://www.europarl.europa.eu/RegData/etudes/STUD/2021/662906/IPOL_STU(2021)662906_EN.pdf]]']",['8'],['https://ec.europa.eu/info/funding-tenders/opportunities/portal/screen/opportunities/competitive-calls-cs/45704318'],,['https://ec.europa.eu/info/funding-tenders/opportunities/portal/screen/opportunities/competitive-calls-cs/45704318'],['14143'],['SEDIA'],['14143COMPETITIVE_CALLen'],['43108390'],['2026-05-15T00:00:00.000+0000'],['single-stage'],['31094502'],['AID4SME Open Call 2'],"['<p class=""ql-align-justify"">The AID4SME - Open Call #2 is looking for Technology Developers to develop, test and validate Artificial Intelligence (AI) and Data solutions in the framework of the AID4SME project.</p><p class=""ql-align-justify"">Applicants must submit their proposals to one of the following challenges:</p><ol><li data-list=""bullet"" class=""ql-align-justify""><span class=""ql-ui"" contenteditable=""false""></span>C1.1 Augmented sensing solution</li><li data-list=""bullet"" class=""ql-align-justify""><span class=""ql-ui"" contenteditable=""false""></span>C2.1 Product-production Digital Twins</li><li data-list=""bullet"" class=""ql-align-justify""><span class=""ql-ui"" contenteditable=""false""></span>C2.2 Automated monitoring hygiene inspection for refurbishment</li><li data-list=""bullet"" class=""ql-align-justify""><span class=""ql-ui"" contenteditable=""false""></span>C2.3 Energy system Digital Twin decision support tool</li><li data-list=""bullet"" class=""ql-align-justify""><span class=""ql-ui"" contenteditable=""false""></span>C3.2 Automated machine selection for parts production</li><li data-list=""bullet"" class=""ql-align-justify""><span class=""ql-ui"" contenteditable=""false""></span>C3.3 Battery production digital work instructions & skill capturing</li><li data-list=""bullet"" class=""ql-align-justify""><span class=""ql-ui"" contenteditable=""false""></span>C3.4 Automated warehouse and internal logistics management</li><li data-list=""bullet"" class=""ql-align-justify""><span class=""ql-ui"" contenteditable=""false""></span>C4.1 Smart energy management of unplanned machine downtime</li><li data-list=""bullet"" class=""ql-align-justify""><span class=""ql-ui"" contenteditable=""false""></span>C4.2 Semi-automated EV battery disassembly for recycling</li><li data-list=""bullet"" class=""ql-align-justify""><span class=""ql-ui"" contenteditable=""false""></span>C4.3 Co-bot refrigerator door assembly solutions</li></ol><p class=""ql-align-justify""><strong>The AID4SME Programme #2 is organised in 4 stages of 14 months</strong>. Stage 1 - Plan from 01 November 2026 to 31 November 2026, Stage 2 - Development from 01 December 2026 to 30 June 2027, Stage 3 - Test from 01 July 2027 to 31 August 2027, and Stage 4 - Assessment from 01 September 2027 to 31 December 2027.</p><p class=""ql-align-justify"">During these phases, beneficiaries will have the support of a mentor to monitor project progress and facilitate communication with technical partners.</p><p class=""ql-align-justify""><strong>The programme will select up to 12 applications</strong>, each addressing one of the challenges/topics defined in Section 3 - Challenges of the Annex 1. Guidelines for Applicants, providing a maximum contribution of EUR 200 000.00, to be paid in form of lump sums at the end of Periods 1, 2 and 3 (30% + 40% + 30%) (section7.1.2).</p>']",['AID4SME'],2026-07-05 07:28:53.466610+00:00
2.148.3,186296PROSPECTSEN,https://webgate.ec.europa.eu/prospect/external/publishedcalls.htm?callId=186296,text/plain,en,SEDIA,SEDIA,Rule of Law (ROLAW III),0.0,Rule of Law (ROLAW III),False,[],[],Rule of Law (ROLAW III). Available at: https://webgate.ec.europa.eu/prospect/external/publishedcalls.htm?callId=186296,['EuropeAid/186296/DD/ACT/MK'],['text/plain'],['2026-05-13T10:00:00.000+0000'],['2026-09-21T14:00:24.000+0000'],['en'],['Rule of Law (ROLAW III)'],['2'],['https://webgate.ec.europa.eu/prospect/external/publishedcalls.htm?callId=186296'],,['https://webgate.ec.europa.eu/prospect/external/publishedcalls.htm?callId=186296'],,['SEDIA'],['186296PROSPECTSEN'],['111111'],['2026-05-13T10:00:00.000+0000'],,['31094502'],,,,2026-07-05 07:28:53.466610+00:00
2.148.3,14164COMPETITIVE_CALLen,https://ec.europa.eu/info/funding-tenders/opportunities/portal/screen/opportunities/competitive-calls-cs/47038104,text/plain,en,SEDIA,SEDIA,Third Call for Pilots Work Strand 1 - Connecting Existing Local Digital Twins,0.0,Third Call for Pilots Work Strand 1 - Connecting Existing Local Digital Twins,False,[],[],Towards networked Local Digital Twins in the EU. Available at: https://ec.europa.eu/info/funding-tenders/opportunities/portal/screen/opportunities/competitive-calls-cs/47038104,['DIGITAL-2024-CLOUD-DATA-AI-07-DIGITALTWIN'],['text/plain'],['2026-05-13T00:00:00.000+0000'],['2026-07-13T23:59:00.000+0000'],['en'],['Towards networked Local Digital Twins in the EU'],['8'],['https://ec.europa.eu/info/funding-tenders/opportunities/portal/screen/opportunities/competitive-calls-cs/47038104'],,['https://ec.europa.eu/info/funding-tenders/opportunities/portal/screen/opportunities/competitive-calls-cs/47038104'],['14164'],['SEDIA'],['14164COMPETITIVE_CALLen'],['43152860'],['2026-05-13T00:00:00.000+0000'],['single-stage'],['31094502'],['Third Call for Pilots Work Strand 1 - Connecting Existing Local Digital Twins'],"['<p><strong>Task description</strong></p><p><strong>The Local Digital Twins for Smart Sustainable Cities (LDT4SSC) initiative is launching an Open Call for Pilots to engage European local and regional authorities, as well as a wide range of stakeholders, including public administrations at local, regional, and national levels, businesses, technology developers, suppliers, research institutions, and academia, in building a networked ecosystem of Local Digital Twins (LDTs).</strong></p><p><strong>The third call concerns Work Strand 1, 2 and 3 (WS1, WS2 and WS3), of which WS1 aims to interconnect existing LDTs and create a federated EU-wide network supporting seamless data exchange and interoperability. WS1 focuses on federation and interoperability, requiring pilots to prioritise cross-border data exchange and the creation of shared data spaces, demanding a baseline of digital maturity and collaboration among multiple public authorities.</strong></p><p><br></p><p><strong><u>Who Can Apply</u></strong></p><p><strong>The open call is designed to engage a diverse range of local and regional communities. Participation is open to public administrations at local, regional, and national levels, including European Digital Infrastructure Consortia (EDICs) such as the LDT CitiVERSE EDIC, businesses, technology developers, suppliers, research institutions, academia, as well as non-governmental organizations, non-profit organizations, and other research partners or civil society actors.</strong></p><p><strong>To ensure the replicability and scalability of each pilot, every consortium is required to include at least one additional partner from the private sector, such as a service provider, private association with legal status, trusted third party, or a private representative of a use-case sector.</strong></p><p><strong>Members of the LDT4SSC Consortium are not permitted to join pilot consortia.</strong></p><p><strong>All partners must be based in eligible countries and be able to co-finance at least 50% of the project costs.</strong></p><p><br></p><p><strong><u>Consortia Eligibility Criteria</u></strong></p><ol><li data-list=""ordered""><span class=""ql-ui"" contenteditable=""false""></span><strong>Each pilot consortium must comprise at least two local and regional authorities drawn from two different eligible countries. Eligible countries include EU Member States (including outermost regions and overseas territories), Norway, Iceland, Liechtenstein, and listed EEA and DEP Associated countries.</strong></li><li data-list=""ordered""><span class=""ql-ui"" contenteditable=""false""></span><strong>To ensure the&nbsp;replicability and scalability&nbsp;of the pilot, each consortium is encouraged to involve&nbsp;at least one additional partner&nbsp;from one of the following categories: private entity (e.g., service provider), private association with legal status, trusted third party, or private representative of a use-case sector.</strong></li><li data-list=""ordered""><span class=""ql-ui"" contenteditable=""false""></span><strong>Security restrictions: Consortium members must not be controlled by an ineligible country. If there is a potential risk, entities may provide a guarantee.</strong></li><li data-list=""ordered""><span class=""ql-ui"" contenteditable=""false""></span><strong>Ownership Control Declaration (OCD)&nbsp;requirements: All entities except those validated as public bodies by EU countries must submit an OCD. It must be self-declared at proposal submission and, if the pilot is awarded, the official OCD must be provided&nbsp;within 14 days&nbsp;of notification. If a consortium member is controlled by an ineligible country, participation will be conditional on submission and acceptance of an adequate guarantee.</strong></li></ol><p><br></p><p><strong><u>Scope</u></strong></p><p><strong>WS1 is dedicated to&nbsp;connecting and federating&nbsp;LDTs&nbsp;across cities, communities and regions to create a&nbsp;unified, interoperable and reusable EU LDT ecosystem. In doing so, WS1 will support communities in accessing a comprehensive set of technical open specifications and open-source software components to interconnect their LDTs through Data Spaces, with most solutions expected to align with the SIMPL framework where appropriate. These efforts are expected to draw on the European Data Space for Smart and Sustainable Cities and Communities (DS4SSCC) as well as relevant thematic data spaces such as those for tourism, mobility and other domains, with which data exchange is envisaged.</strong></p><p><strong>By leveraging standards, pilots will break down silos, scale up EU-wide datasets and onboard less-advanced communities into the LDT network. The goal is hence to&nbsp;enhance decision-making (particularly in key EU policies&nbsp;(like mobility, energy efficiency, or environmental), reduce redundancies and foster a collaborative data economy, ultimately laying the foundation for a resilient, interconnected digital infrastructure that supports Europe’s green and digital ambitions.</strong></p><p><strong>Through real-world use cases, such as cross-border traffic management or multi-city resource optimisation, it is expected that WS1 will transform fragmented local initiatives into a&nbsp;cohesive, replicable, scalable and reusable federation of LDTs, driving collective innovation and efficiency.</strong></p><p><br></p><p><strong><u>Available funding and Co-Financing</u></strong></p><p><strong>The EU contribution for WS1 under the third call amounts to&nbsp;€2,376,355.00, to be distributed across approximately&nbsp;2-3 selected consortia. The co-funding model ensures that EU support covers up to&nbsp;50% of eligible expenses, with applicants demonstrating the capacity to finance&nbsp;at least&nbsp;50% of pilot costs&nbsp;from their own resources.</strong></p><p><strong>Key financial rules:</strong></p><ol><li data-list=""ordered""><span class=""ql-ui"" contenteditable=""false""></span><strong>The&nbsp;maximum grant per third-party&nbsp;(across multiple consortia and awarded pilot projects) is €500,000. Any expenses exceeding this amount must be fully covered by consortium members.</strong></li><li data-list=""ordered""><span class=""ql-ui"" contenteditable=""false""></span><strong>The&nbsp;maximum cumulative grant per consortium&nbsp;is €1,000,000.</strong></li><li data-list=""ordered""><span class=""ql-ui"" contenteditable=""false""></span><strong>Applicants must cover at least&nbsp;50% of total pilot costs.</strong></li></ol><p><strong>Co-financing must be a&nbsp;dedicated, auditable cost, explicitly included in the pilot budget and documented according to normal accounting practices. Only direct monetary contributions or monetized resources listed in the budget are eligible; in-kind contributions not monetized in the budget are not admissible.</strong></p><p><strong>All costs must be actual, incurred during the pilot period, and fully compliant with applicable regulations, including state aid rules and prevention of double funding.</strong></p><p><strong>Participating local and regional administrations, as well as any other consortium members contributing financially, must demonstrate their capacity to provide at least&nbsp;50% co-financing&nbsp;through a&nbsp;Letter of Commitment.</strong></p><p><strong>The pilot consortium will receive&nbsp;30% of the total grant as pre-financing&nbsp;upon signing the Grant Agreement, with the remaining&nbsp;70% paid in two instalments&nbsp;based on performance during the midterm and final reporting periods.</strong></p><p><strong>For more information, please refer to the relevant&nbsp;Call for Pilots Manual&nbsp;at&nbsp;<u><a href=""https://ldt4ssc.eu/opencalls/"" rel=""noopener noreferrer"" target=""_blank"">https://ldt4ssc.eu/opencalls/</a></u></strong></p><p><br></p><p><strong><u>Additional information</u></strong></p><p><strong>We invite applicants to be part of the Stakeholder Forum to engage and network with likeminded organisations aiming to realise the objectives for LDT4SSC. This forum also offers opportunities to directly liaise with the LDT4SSC consortium members. More information at&nbsp;<u><a href=""https://ldt4ssc.eu/"" rel=""noopener noreferrer"" target=""_blank"">https://ldt4ssc.eu/</a></u></strong></p><p><strong>Applicants are responsible for checking the LDT4SSC project website (<u><a href=""https://ldt4ssc.eu/opencalls/"" rel=""noopener noreferrer"" target=""_blank"">https://ldt4ssc.eu/opencalls/</a></u>) for updated information related to this Call, including the information about the schedule for Info Sessions.</strong></p><p><br></p><p>For any inquiries, please contact&nbsp;<strong><u><a href=""mailto:info@ldt4ssc.eu"" rel=""noopener noreferrer"" target=""_blank"">info@ldt4ssc.eu</a></u>.</strong></p><p>Project details</p><p>Project acronym</p><p>LDT4SSC</p><p>Full name of the EU funded project</p><p>Local Digital Twins for Smart and Sustainable Communities</p><p>Grant agreement number</p><p>101226211</p><p>Topic</p><p>DIGITAL-2024-CLOUD-DATA-AI-07-DIGITALTWIN - Towards networked Local Digital Twins in the EU</p><p>Programme</p><p>DIGITAL</p>']",['LDT4SSC'],2026-07-05 07:28:53.466610+00:00
